IdSerie,Nome,Trama,Locandina,Voto,AnnoInizio,imgOrizzontale
81167570,"El final del parai`so","In Colombia la nuova direttrice della DEA prende di mira una banda di spacciatori di una potente droga, scontrandosi con un nemico che possiede un'ampia rete di contatti.",./serieTv/ElFinaldelParai`so/ElFinaldelParai`soLocandina.jpg,5.6,2019,./serieTv/ElFinaldelParai`so/ElFinaldelParaisoOrizzontale.jpg
81144163,"Amar y vivir","Un campagnolo squattrinato alla ricerca della sorella scappata di casa s'innamora a Bogotá di un'aspirante cantante, ma resta invischiato nella criminalita` organizzata.",./serieTv/AmaryVivir/AmaryVivirLocandina.jpg,7.1,2020,./serieTv/AmaryVivir/AmaryVivirOrizzontale.jpg
80101401,"The Deep","I Nekton sono una famiglia di esploratori subacquei che scoprono i segreti nascosti degli oceani, come citta` sommerse, creature marine e pirati.",./serieTv/TheDeep/TheDeepLocandina.jpg,7.9,2015,./serieTv/TheDeep/TheDeepOrizzontale.jpg
80045820,"Danger Mouse","La piu` scaltra spia del mondo torna a difendere l'umanita` con l'aiuto dello sventurato criceto Penfold e armato di una sfilza di gadget super tecnologici.",./serieTv/DangerMouse/DangerMouseLocandina.jpg,7.1,2015,./serieTv/DangerMouse/DangerMouseOrizzontale.jpg
80044965,"Puffin Rock","La vita scorre felice a Puffin Rock, dove la pulcinella di mare Oona, il fratellino Baba e i loro amici imparano il valore della natura, dell'amicizia e della famiglia.",./serieTv/PuffinRock/PuffinRockLocandina.jpg,8.7,2015,./serieTv/PuffinRock/PuffinRockOrizzontale.jpg
80997339,"Sirius the Jaeger","Nella Tokyo imperiale, coloro che si fanno chiamare "Jaeger" danno la caccia ai vampiri in cerca dell'Arca di Sirius. Tra loro c'e` anche Yuliy, un giovane licantropo.",./serieTv/SiriustheJaeger/SiriustheJaegerLocandina.jpg,6.8,2018,./serieTv/SiriustheJaeger/SiriustheJaegerOrizzontale.jpg
81091825,"Betty en NY","A New York una giovane ispanica lotta per sfondare nel mondo della moda, ma trovare l'amore sara` un'impresa ancora piu` difficile.",./serieTv/BettyenNY/BettyenNYLocandina.jpg,7.8,2019,./serieTv/BettyenNY/BettyenNYOrizzontale.jpg
81243996,"Hi Bye, Mama!","When the ghost of a woman gains a second chance at life for 49 days, she reappears in front of her remarried husband and young daughter.",./serieTv/HiByeMama!/HiBye,Mama!Locandina.jpg,8.0,2020,./serieTv/HiByeMama!/HiByeMama!Orizzontale.jpg
80198950,"Lunatics","Questa serie di finti documentari segue le singolari esistenze di sei spostati eccentrici, e a tratti volgari, che vivono in modo anticonformista.",./serieTv/Lunatics/LunaticsLocandina.jpg,6.6,2019,./serieTv/Lunatics/LunaticsOrizzontale.jpg
80170368,"Ugly Delicious","Solo sapore, niente stupidate. La star dei fornelli David Chang parte con gli amici per una gustosa caccia tra culture diverse alla ricerca del cibo piu` buono del mondo.",./serieTv/UglyDelicious/UglyDeliciousLocandina.jpg,7.8,2018,./serieTv/UglyDelicious/UglyDeliciousOrizzontale.jpg
80994108,"Sisters","Con la confessione del padre moribondo Julia scopre di avere oltre 100 fratelli e due sorelle: la star TV in difficolta` Roxy e la rigida avvocatessa Edie.",./serieTv/Sisters/SistersLocandina.jpg,7.6,2018,./serieTv/Sisters/SistersOrizzontale.jpg
81006858,"Floor Is Lava","Le squadre gareggiano in stanze allagate dalla lava saltando da una sedia all'altra, aggrappandosi alle tende e dondolandosi dai lampadari. Si`... davvero incredibile.",./serieTv/FloorIsLava/FloorIsLavaLocandina.jpg,5.3,2020,./serieTv/FloorIsLava/FloorIsLavaOrizzontale.jpg
80073289,"Netflix Presents: The Characters","Abbiamo chiesto a otto comici emergenti di presentarci i loro migliori sketch e le improvvisazioni piu` sfrenate. Il risultato e` una nuova serie comica senza precedenti.",./serieTv/TheCharacters/TheCharactersLocandina.jpg,5.4,2016,./serieTv/TheCharacters/TheCharactersOrizzontale.jpg
70309056,"Cardcaptor Sakura","Una ragazzina rompe il sigillo di un libro magico liberando gli spiriti delle carte contenute al suo interno e deve cosi` diventare una "Catturacarte" per catturarli.",./serieTv/KadokyaputaSakura/KadokyaputaSakuraLocandina.jpg,8.0,1998,./serieTv/KadokyaputaSakura/KadokyaputaSakuraOrizzontale.jpg
80201728,"Lenox Hill","In questa docuserie quattro medici del celebre Lenox Hill Hospital di New York cercano l'equilibrio tra la vita personale e la dedizione verso i pazienti.",./serieTv/LenoxHill/LenoxHillLocandina.jpg,8.7,2020,./serieTv/LenoxHill/LenoxHillOrizzontale.jpg
81278699,"Creator's File: GOLD","Il comico Ryuji Akiyama si burla dei protagonisti della creativita` giapponese con un infallibile umorismo inglese e con la partecipazione speciale di alcune guest star.",./serieTv/CreatorsFileGold/CreatorsFileGoldLocandina.jpg,,2021,./serieTv/CreatorsFileGold/CreatorsFileGoldOrizzontale.jpg
81020518,"Criminal: Germany","In the interview room, detectives go head-to-head with suspects and try to get to the truth -- even if it means breaking the rules and risking it all.",./serieTv/CriminalGermany/CriminalGermanyLocandina.jpg,7.7,2019,./serieTv/CriminalGermany/CriminalGermanyOrizzontale.jpg
80040118,"K","Un ragazzo ricercato per un crimine che non ricorda di aver commesso deve fuggire dalle grinfie di due potenti re e dei loro schieramenti.",./serieTv/K/KLocandina.jpg,7.1,2012,./serieTv/K/KOrizzontale.jpg
81239671,"On the Verge - Al limite","Una chef, una madre single, un'ereditiera e una donna in cerca di lavoro affrontano amore, lavoro e crisi di mezza eta` negli anni prima della pandemia a Los Angeles.",./serieTv/OntheVerge/OntheVergeLocandina.jpg,,2021,./serieTv/OntheVerge/OntheVergeOrizzontale.jpg
80063867,"The Family","Una misteriosa organizzazione fondamentalista cristiana, conosciuta come la "Famiglia", esercita un'enorme influenza a Washington per realizzare le proprie ambizioni.",./serieTv/TheFamily/TheFamilyLocandina.jpg,6.4,2019,./serieTv/TheFamily/TheFamilyOrizzontale.jpg
80186848,"Jack Whitehall: Travels with My Father","L'allegro comico Jack Whitehall e il noioso padre Michael si avventurano in viaggi insoliti e divertenti in terre sconosciute per rafforzare il loro rapporto.",./serieTv/JackWhitehallTravelswithMyFather/JackWhitehallTravelswithMyFatherLocandina.jpg,7.7,2017,./serieTv/JackWhitehallTravelswithMyFather/JackWhitehallTravelswithMyFatherOrizzontale.jpg
81249713,"Sneakerheads","Il padre di famiglia Devin ricade nell'ossessione delle sneaker quando l'amico Bobby lo coinvolge nella compravendita di un mitico paio di scarpe.",./serieTv/Sneakerheads/SneakerheadsLocandina.jpg,6.2,2020,./serieTv/Sneakerheads/SneakerheadsOrizzontale.jpg
80152350,"Neo Yokio","Assieme al suo fedele maggiordomo robot, Kaz Kaan insegue l'amore, la moda e le forze soprannaturali nell'inquietante alta societa` di Neo Yokio.",./serieTv/NeoYokio/NeoYokioLocandina.jpg,5.8,2017,./serieTv/NeoYokio/NeoYokioOrizzontale.jpg
80057883,"Abstract: The Art of Design","Un viaggio nelle menti dei piu` innovativi designer in diversi campi per scoprire l'impatto che il design ha su ogni aspetto della nostra vita.",./serieTv/AbstractTheArtofDesign/AbstractTheArtofDesignLocandina.jpg,8.4,2017,./serieTv/AbstractTheArtofDesign/AbstractTheArtofDesignOrizzontale.jpg
80215997,"100 Humans","Un gruppo di cento persone di sana costituzione partecipa a giocosi esperimenti su temi come eta`, sesso, felicita` e altri aspetti degli esseri umani.",./serieTv/100Humans/100HumansLocandina.jpg,5.7,2020,./serieTv/100Humans/100HumansOrizzontale.jpg
81122572,"Middleditch & Schwartz","Thomas Middleditch e Ben Schwartz trasformano semplici spunti in storie gloriose e divertenti in questa serie di speciali comici di pura improvvisazione.",./serieTv/MiddleditchSchwartz/MiddleditchSchwartzLocandina.jpg,8.7,2020,./serieTv/MiddleditchSchwartz/MiddleditchSchwartzOrizzontale.jpg
81277835,"Social Distance","Questa serie antologica girata durante il lockdown mostra gli aspetti divertenti e cupi di come le persone mantengono i contatti pur restando a distanza.",./serieTv/SocialDistance/SocialDistanceLocandina.jpg,5.7,2020,./serieTv/SocialDistance/SocialDistanceOrizzontale.jpg
81034679,"We Are the Champions","Esplora alcune singolari discipline, strane o bizzarre che siano, e scopri le comunita` che le praticano con passione in questa docuserie.",./serieTv/WeAretheChampions/WeAretheChampionsLocandina.jpg,7.1,2020,./serieTv/WeAretheChampions/WeAretheChampionsOrizzontale.jpg
80238106,"Team Kaylie","Dopo qualche problema con la legge, la popolare Kaylie Konrad scambia la fama sui social con il caos di un doposcuola dedicato alla natura, come da ordine del tribunale.",./serieTv/TeamKaylie/TeamKaylieLocandina.jpg,4.4,2019,./serieTv/TeamKaylie/TeamKaylieOrizzontale.jpg
80183051,"7SEEDS","Al suo risveglio, Shy Natsu scopre di appartenere a un gruppo scelto per garantire la sopravvivenza dell'umanita`. Insieme dovranno cavarsela su una Terra trasformata.",./serieTv/7Seeds/7SeedsLocandina.jpg,6.4,2019,./serieTv/7Seeds/7SeedsOrizzontale.jpg
81010786,"La brigata Costa del Sol","Quattro agenti intrepidi e impulsivi creano un'unita` speciale antinarcotici per combattere la nascita del traffico di droga sulla Costa del Sol spagnola negli anni '70.",./serieTv/BrigadaCostadelSol/BrigadaCostadelSolLocandina.jpg,6.8,2019,./serieTv/BrigadaCostadelSol/BrigadaCostadelSolOrizzontale.jpg
81234353,"Darwin`s Game","Il liceale Kaname attiva un'app misteriosa e senza saperlo si trova coinvolto in un gioco dove utenti dalle abilita` soprannaturali si sfidano tra loro.",./serieTv/DarwinsGame/DarwinsGameLocandina.jpg,7.3,2020,./serieTv/DarwinsGame/DarwinsGameOrizzontale.jpg
81256675,"Hellbound","Esseri ultraterreni emettono violente condanne, mandando le persone all'inferno e dando origine a un gruppo religioso fondato sull'idea della giustizia divina.",./serieTv/SeoreunijimanYeolilgobibmida/SeoreunijimanYeolilgobibmidaLocandina.jpg,7.8,2021,./serieTv/SeoreunijimanYeolilgobibmida/SeoreunijimanYeolilgobibmidaOrizzontale.jpg
80198545,"Trailer Park Boys: Out of the Park: USA","Bubbles, Julian e Ricky si rimettono in viaggio e attraversano il confine canadese, in cerca di oltraggiose avventure sul territorio americano.",./serieTv/TrailerParkBoysOutofthePark/TrailerParkBoysOutoftheParkLocandina.jpg,6.7,2017,./serieTv/TrailerParkBoysOutofthePark/TrailerParkBoysOutoftheParkOrizzontale.jpg
81035137,"Queen Sono","La spia sudafricana Queen Sono finisce in una losca rete in cui affari e politica si mescolano quando cerca di scoprire la verita` sulla morte della madre.",./serieTv/QueenSono/QueenSonoLocandina.jpg,6.0,2020,./serieTv/QueenSono/QueenSonoOrizzontale.jpg
81020513,"Criminal: France","Secrets emerge and entire cases unravel inside a police interview room in Paris, where suspects and investigators face off in an intricate dance.",./serieTv/CriminalFrance/CriminalFranceLocandina.jpg,7.2,2019,./serieTv/CriminalFrance/CriminalFranceOrizzontale.jpg
80144146,"The Investigator: A British Crime Story","Dopo 40 anni di indagini inconcludenti, il famoso criminologo Mark Williams-Thomas riesamina una serie di misteriosi omicidi.",./serieTv/TheInvestigatorABritishCrimeStory/TheInvestigatorABritishCrimeStoryLocandina.jpg,5.7,2016,./serieTv/TheInvestigatorABritishCrimeStory/TheInvestigatorABritishCrimeStoryOrizzontale.jpg
81318514,"Dancing Queens","Una ballerina talentuosa inizia a fare le pulizie in un club di drag queen in difficolta`, sognando di partecipare allo show e attirando l'attenzione del coreografo.",./serieTv/DancingQueen/DancingQueenLocandina.jpg,7.0,2021,./serieTv/DancingQueen/DancingQueenOrizzontale.jpg
80241234,"The Ghost Bride","Malacca, fine '800. Li Lan si ritrova nell'aldila` e viene coinvolta in un mistero legato al sinistro decesso del figlio di una famiglia benestante.",./serieTv/TheGhostBride/TheGhostBrideLocandina.jpg,6.0,2020,./serieTv/TheGhostBride/TheGhostBrideOrizzontale.jpg
80036140,"Las muñecas de la mafia","Tratta dal libro "Las Fantásticas", questa telenovela emozionante segue la vita tumultuosa di cinque donne che si ritrovano coinvolte con la mafia.",./serieTv/Lasmuñecasdelamafia/LasmuñecasdelamafiaLocandina.jpg,6.6,2009,./serieTv/Lasmuñecasdelamafia/LasmunecasdelamafiaOrizzontale.jpg
81343898,"The Nokdu Flower","As a peasant revolution for equality brews in 19th-century Joseon, two half-brothers fight for their beliefs on opposite sides of the conflict.",./serieTv/JoseonrokoNokdujeon/JoseonrokoNokdujeonLocandina.jpg,7.9,2019,./serieTv/JoseonrokoNokdujeon/JoseonrokoNokdujeonOrizzontale.jpg
80176893,"The Good Doctor","Un chirurgo di talento nello spettro dell'autismo e della sindrome del savant e` assunto in un prestigioso ospedale, dove affronta lo scetticismo di colleghi e pazienti.",./serieTv/DakteoPeurijeuneo/DakteoPeurijeuneoLocandina.jpg,7.8,2017,./serieTv/DakteoPeurijeuneo/DakteoPeurijeuneoOrizzontale.jpg
80242491,"The Stranded","Su un'isola devastata da uno tsunami gli studenti di una scuola esclusiva cercano di non perdere la speranza. Alcune forze misteriose, pero`, remano contro di loro.",./serieTv/TheStranded/TheStrandedLocandina.jpg,6.3,2019,./serieTv/TheStranded/TheStrandedOrizzontale.jpg
80223368,"Gigantosaurus","Quattro amici preistorici vivono mille avventure mentre cercano di risolvere il mistero di una grande creatura feroce. La serie e` tratta dal libro di Jonny Duddle.",./serieTv/Gigantosaurus/GigantosaurusLocandina.jpg,7.1,2019,./serieTv/Gigantosaurus/GigantosaurusOrizzontale.jpg
80223556,"Il principe di Peoria","Un principe burlone che vuole sperimentare la vita di un comune adolescente lascia il suo regno per vivere in incognito con una mamma single e il suo studioso figlio.",./serieTv/PrinceofPeoria/PrinceofPeoriaLocandina.jpg,5.9,2018,./serieTv/PrinceofPeoria/PrinceofPeoriaOrizzontale.jpg
80049065,"W/ Bob & David","Dopo essere stati congedati con disonore dai Navy Seal, Bob e David tornano a servire il paese nel modo che gli riesce meglio: far ridere!",./serieTv/W/BobandDavid/W/BobandDavidLocandina.jpg,7.4,2015,./serieTv/WBobandDavid/WBobandDavidOrizzontale.jpg
80211621,"Huge in France","Desideroso di riavvicinarsi al figlio, il famoso comico francese Gad Elmaleh si trasferisce a Los Angeles, rinunciando alla fama e ai privilegi di cui godeva in patria.",./serieTv/HugeinFrance/HugeinFranceLocandina.jpg,6.8,2019,./serieTv/HugeinFrance/HugeinFranceOrizzontale.jpg
80192734,"Barbie Dreamhouse Adventures","Scopri Barbie e i suoi amici, compreso il vicino di casa Ken, in questo avventuroso video blog animato girato all'interno della nuova casa dei sogni della sua famiglia.",./serieTv/BarbieDreamhouseAdventures/BarbieDreamhouseAdventuresLocandina.jpg,6.8,2018,./serieTv/BarbieDreamhouseAdventures/BarbieDreamhouseAdventuresOrizzontale.jpg
81279126,"Dan, hana-ui sarang","Come punizione per essersi intromesso nelle vicende umane, un angelo riceve l'impossibile missione di trovare un'anima gemella a una ballerina dal cuore di pietra.",./serieTv/DanHanauiSarang/Dan,HanauiSarangLocandina.jpg,7.7,2019,./serieTv/DanHanauiSarang/DanHanauiSarangOrizzontale.jpg
80244690,"Goop lab con Gwyneth Paltrow","Sempre ispirati da genuina curiosita`, Gwyneth Paltrow e il team di goop si occupano di sostanze psichedeliche, energia e altri temi impegnativi relativi al benessere.",./serieTv/TheGoopLab/TheGoopLabLocandina.jpg,2.5,2020,./serieTv/TheGoopLab/TheGoopLabOrizzontale.jpg
81327503,"Pretty Smart","Chelsea e` una ragazza studiosa che scopre di avere molto da imparare sulla felicita` quando si ritrova a convivere con la vivace sorella e tre coinquilini.",./serieTv/PrettySmart/PrettySmartLocandina.jpg,,2021,./serieTv/PrettySmart/PrettySmartOrizzontale.jpg
81054849,"The Disastrous Life of Saiki K.: Reawakened","Kusuo e` tornato con il suo gruppo di sedicenti amici per altre disavventure psichiche. Se prima non aveva abbastanza problemi, ora ne ha ancora di piu`.",./serieTv/TheDisastrousLifeofSaikiK.Reawakened/TheDisastrousLifeofSaikiK.ReawakenedLocandina.jpg,7.9,2019,./serieTv/TheDisastrousLifeofSaikiK.Reawakened/TheDisastrousLifeofSaikiK.ReawakenedOrizzontale.jpg
80115119,"Lost Ollie","In questa serie per famiglie ispirata al libro "Ollie's Odyssey", un giocattolo cerca per tutta la campagna il ragazzino che lo ha perso.",./serieTv/LostOllie/LostOllieLocandina.jpg,,,./serieTv/LostOllie/LostOllieOrizzontale.jpg
81183493,"Taj Mahal 1989","Nel 1989 alla Lucknow University e dintorni, coppie di eta` diverse esplorano le dinamiche dell'amore attraverso matrimonio, storie d'amore e amicizie.",./serieTv/TajMahal1989/TajMahal1989Locandina.jpg,7.5,2020,./serieTv/TajMahal1989/TajMahal1989Orizzontale.jpg
80194558,"Selection Day","Due prodigi del cricket in eta` adolescenziale lottano contro il dispotico padre e la societa` per difendere la proprie identita` e ambizioni.",./serieTv/SelectionDay/SelectionDayLocandina.jpg,7.4,2018,./serieTv/SelectionDay/SelectionDayOrizzontale.jpg
80092878,"Good Morning Call","Una liceale va finalmente a vivere da sola, ma e` costretta a condividere la casa col ragazzo piu` popolare della scuola. Nessuno deve scoprire che vivono insieme.",./serieTv/GoodMorning-CallGuddomôningukôru/GoodMorning-CallGuddomôningukôruLocandina.jpg,7.5,2016,./serieTv/GoodMorning-CallGuddomôningukôru/GoodMorning-CallGuddomoningukoruOrizzontale.jpg
81350683,"In buone mani","Una madre single con una malattia terminale incontra un affascinante scapolo mentre deve fare i conti con il futuro dell'ostinato figlio di sei anni.",./serieTv/ChomyeoneSaranghamnida/ChomyeoneSaranghamnidaLocandina.jpg,7.4,2022,./serieTv/ChomyeoneSaranghamnida/ChomyeoneSaranghamnidaOrizzontale.jpg
81011059,"Booba","Per il piccolo Booba il mondo e` un mistero. Lui pero` affronta le cose curiose attorno a lui con meraviglia, ritrovando l'avventura in tutto cio` che lo circonda.",./serieTv/Booba/BoobaLocandina.jpg,6.9,2014,./serieTv/Booba/BoobaOrizzontale.jpg
81177545,"Hyena","Per sopravvivere in un mondo spietato, due avvocati rivali con una clientela di alto livello tolgono di mezzo qualsiasi cosa ostacoli le loro ambizioni.",./serieTv/Hyena/HyenaLocandina.jpg,7.8,2020,./serieTv/Hyena/HyenaOrizzontale.jpg
81026300,"Next in Fashion","Stilisti talentuosi provenienti da ogni parte del mondo si sfidano per vincere 250.000 dollari e cogliere l'opportunita` di diventare il nuovo astro nascente della moda.",./serieTv/NextinFashion/NextinFashionLocandina.jpg,7.3,2020,./serieTv/NextinFashion/NextinFashionOrizzontale.jpg
81039557,"Q-Force","Una superspia gay e la sua sgangherata squadra LGBTQ si battono per dimostrare quanto valgono all'agenzia che li ha sminuiti. Oggi West Hollywood… domani il mondo intero!",./serieTv/Q-Force/Q-ForceLocandina.jpg,,2021,./serieTv/Q-Force/Q-ForceOrizzontale.jpg
80161702,"The Confession Tapes","I fatti di cronaca nera presentati in questa serie riguardano condannati per omicidio che definiscono le proprie confessioni come estorte, involontarie o false.",./serieTv/TheConfessionTapes/TheConfessionTapesLocandina.jpg,7.5,2017,./serieTv/TheConfessionTapes/TheConfessionTapesOrizzontale.jpg
80156688,"Flint Town","Per due anni i registi hanno seguito i poliziotti di Flint, in Michigan, mostrando un dipartimento che affronta problemi imprevedibili in condizioni insostenibili.",./serieTv/FlintTown/FlintTownLocandina.jpg,7.9,2018,./serieTv/FlintTown/FlintTownOrizzontale.jpg
70220028,"Hotel Transylvania","Il proprietario dell'Hotel Transilvania si trova a interpretare il ruolo di padre iperprotettivo quando un corteggiatore indesiderato s'interessa alla figlia adolescente.",./serieTv/HotelTransylvania/HotelTransylvaniaLocandina.jpg,5.5,2012,./serieTv/HotelTransylvania/HotelTransylvaniaOrizzontale.jpg
81033727,"Shadow","Perseguitato da un lutto, un ex poliziotto con la rara capacita` di non sentire il dolore si mette da solo in cerca dei criminali sfuggiti alla polizia di Johannesburg.",./serieTv/Shadow/ShadowLocandina.jpg,6.6,2019,./serieTv/Shadow/ShadowOrizzontale.jpg
81409141,"Transfert","La vita di un giovane psicologo si complica quando le interazioni con i pazienti rivelano i suoi stessi scheletri nell'armadio.",./serieTv/Transferts/TransfertsLocandina.jpg,7.3,2018,./serieTv/Transferts/TransfertsOrizzontale.jpg
80049870,"I Croods - Le origini","Torna la prima famiglia della storia con esilaranti avventure, tra sport, notti fuori casa e altre meraviglie in un mondo pieno di strane creature.",./serieTv/DawnoftheCroods/DawnoftheCroodsLocandina.jpg,6.0,2015,./serieTv/DawnoftheCroods/DawnoftheCroodsOrizzontale.jpg
80189648,"Hyperdrive","I migliori piloti del mondo mettono alla prova i loro limiti con auto personalizzate in uno dei piu` grandi percorsi automobilistici a ostacoli mai costruiti.",./serieTv/Hyperdrive/HyperdriveLocandina.jpg,8.1,2019,./serieTv/Hyperdrive/HyperdriveOrizzontale.jpg
80987064,"RESIDENT EVIL: Infinite Darkness","Anni dopo gli orrori di Raccoon City, Leon e Claire sono travolti da un oscuro complotto quando un attacco virale colpisce la Casa Bianca.",./serieTv/ResidentEvil/ResidentEvilLocandina.jpg,,2021,./serieTv/ResidentEvil/ResidentEvilOrizzontale.jpg
81227121,"The Victims' Game","Scoperto il legame tra la figlia, con cui non ha piu` contatti, e misteriosi omicidi, un esperto della scientifica affetto da Asperger rischia tutto per risolvere il caso.",./serieTv/TheVictimsGame/TheVictimsGameLocandina.jpg,7.4,2020,./serieTv/TheVictimsGame/TheVictimsGameOrizzontale.jpg
81343880,"Hot Stove League","During off-season, a professional baseball team ranked dead last in the league hires an unorthodox manager who's determined to push it to the top.",./serieTv/StoveLeague/StoveLeagueLocandina.jpg,8.4,2019,./serieTv/StoveLeague/StoveLeagueOrizzontale.jpg
80213643,"Chip and Potato","L'adorabile cagnolina Chip comincia l'asilo, stringe nuove amicizie e fa nuove esperienze grazie anche all'aiuto di Potato, la sua amica segreta che e` una topolina.",./serieTv/ChipandPotato/ChipandPotatoLocandina.jpg,6.2,2019,./serieTv/ChipandPotato/ChipandPotatoOrizzontale.jpg
81020523,"Criminal: Spagna","I giochi psicologici non mancano tra detective e sospetti in una sala interrogatori in cui si respira la tensione e dove le risposte a volte esigono un prezzo morale.",./serieTv/CriminalSpain/CriminalSpainLocandina.jpg,6.9,2019,./serieTv/CriminalSpain/CriminalSpainOrizzontale.jpg
80201328,"Sugar Rush","Il cronometro e` l'ingrediente piu` importante, con le squadre che si sfidano a preparare i dolci piu` buoni in una corsa contro il tempo.",./serieTv/SugarRush/SugarRushLocandina.jpg,7.0,2018,./serieTv/SugarRush/SugarRushOrizzontale.jpg
81088239,"Dream Home Makeover: la casa ideale","Assieme a Shea e a Syd dello Studio McGee, alcune famiglie realizzano il sogno di una casa perfetta che rispecchia lo stile personale e unico di ognuna di loro.",./serieTv/DreamHomeMakeover/DreamHomeMakeoverLocandina.jpg,5.6,2020,./serieTv/DreamHomeMakeover/DreamHomeMakeoverOrizzontale.jpg
81154956,"Transformers: Cyberverse","In questa serie animata di fantascienza, Optimus Prime e l'AllSpark sono scomparsi e solo un Bumblebee con problemi di memoria conosce il modo di ritrovarli.",./serieTv/TransformersCyberverse/TransformersCyberverseLocandina.jpg,6.9,2018,./serieTv/TransformersCyberverse/TransformersCyberverseOrizzontale.jpg
81277880,"RuPaul's Secret Celebrity Drag Race","Personaggi famosi si aprono al potere trasformativo del mondo drag e partecipano alle sfide dell'iconica "Drag Race" con l'aiuto di concorrenti di episodi passati.",./serieTv/RuPaulsSecretCelebrityDragRace/RuPaulsSecretCelebrityDragRaceLocandina.jpg,7.0,2020,./serieTv/RuPaulsSecretCelebrityDragRace/RuPaulsSecretCelebrityDragRaceOrizzontale.jpg
81325983,"Beyblade Burst Rise","After training with legendary Valt Aoi, Dante and his trusty Ace Dragon lead the next generation of Bladers to battle in Japan — Beyblade's birthplace.",./serieTv/BeybladeBurst/BeybladeBurstLocandina.jpg,6.7,2016,./serieTv/BeybladeBurst/BeybladeBurstOrizzontale.jpg
80124711,"Super Monsters","I giovani figli dei mostri piu` famosi del mondo cercano di imparare come gestire i loro superpoteri mentre si preparano ad affrontare la scuola materna.",./serieTv/SuperMonsters/SuperMonstersLocandina.jpg,6.6,2017,./serieTv/SuperMonsters/SuperMonstersOrizzontale.jpg
80999455,"It's Bruno!","Un tipo vecchia maniera di Brooklyn si prende cura del suo adorabile cane Bruno, assicurandosi che i vicini gli portino il rispetto che merita.",./serieTv/ItsBruno!/ItsBruno!Locandina.jpg,7.5,2019,./serieTv/ItsBruno!/ItsBruno!Orizzontale.jpg
80195357,"Cannon Busters","Il fuggiasco immortale Philly the Kid e la sua sensazionale Cadillac rosa si uniscono a una droide dall'ottimismo contagioso alla ricerca del principe scomparso.",./serieTv/CannonBusters/CannonBustersLocandina.jpg,6.8,2019,./serieTv/CannonBusters/CannonBustersOrizzontale.jpg
70301578,"Knights of Sidonia","Tratta da un manga di successo, la serie racconta le avventure dell'eroe di una nave colonia che accoglie i superstiti della razza umana in balia di una minaccia aliena.",./serieTv/SidonianoKishi/SidonianoKishiLocandina.jpg,7.8,2014,./serieTv/SidonianoKishi/SidonianoKishiOrizzontale.jpg
81050786,"This Is Pop","Scopri i retroscena delle tue canzoni pop preferite in questa docuserie che analizza l'influenza di festival, Auto-Tune, boy band e molto altro.",./serieTv/ThisIsPop/ThisIsPopLocandina.jpg,7.1,2021,./serieTv/ThisIsPop/ThisIsPopOrizzontale.jpg
80196883,"Rilakkuma and Kaoru","La sua vita sara` anche ordinaria, ma Kaoru sa che a casa l'aspetta il suo coinquilino pigro: un orsacchiotto peloso di nome Rilakkuma.",./serieTv/RilakkumatoKaorusan/RilakkumatoKaorusanLocandina.jpg,8.4,2019,./serieTv/RilakkumatoKaorusan/RilakkumatoKaorusanOrizzontale.jpg
80103318,"Kuromukuro","Un centro di ricerca e` attaccato dai mecha. Studenti, piloti e ricercatori devono difendersi con l'aiuto di misteriosi reperti e di un giovane samurai.",./serieTv/Kuromukuro/KuromukuroLocandina.jpg,7.2,2016,./serieTv/Kuromukuro/KuromukuroOrizzontale.jpg
